{
  "$schema": "http://json-schema.org/draft-07/schema#",
  "type": "object",
  "required": ["background", "goals", "non_goals", "functional_requirements", "constraints", "acceptance_criteria", "open_questions"],
  "properties": {
    "background": { "type": "string" },
    "goals": { "type": "array", "items": { "type": "string" } },
    "non_goals": { "type": "array", "items": { "type": "string" } },
    "functional_requirements": { "type": "array", "items": { "type": "string" } },
    "non_functional_requirements": { "type": "array", "items": { "type": "string" } },
    "constraints": { "type": "array", "items": { "type": "string" } },
    "acceptance_criteria": { "type": "array", "items": { "type": "string" } },
    "open_questions": { "type": "array", "items": { "type": "string" } }
  },
  "additionalProperties": false
}
